{
  "project_id": "proj_demo",
  "seed": 0,
  "ambient": { "relative_humidity": 55, "temperature_c": 21 },
  "parts": [
    {
      "part_id": "proj_demo::panel_top",
      "species": "birch",
      "grain_axis": "length",
      "nominal_mm": { "length": 1200, "width": 400, "thickness": 18 }
    }
  ]
}
